url,title,content,date,previousDiscussionUrl,nextDiscussionUrl
https://finance.naver.com/item/board_read.nhn?code=005930&nid=162782335&st=&sw=&page=1,ㄱ래 니말이 정답이다,진정한고수는 잃나 따나 털때 털줄아는자가 고수지,2021.02.07T20:18,board_read.nhn?code=005930&nid=162782329&st=&sw=&page=1,board_read.nhn?code=005930&nid=162782530&st=&sw=&page=1
https://finance.naver.com/item/board_read.nhn?code=005930&nid=162782329&st=&sw=&page=1,한국이 진정한 강대 선진국이 되려면,국민의짐 같은 수구 꼴통 자칭보수들과 일베충 및 태극기 틀딱들 사라지면 가능 즉  위에 3가지들은 민족의 암적 존재들이란뜻,2021.02.07T20:18,board_read.nhn?code=005930&nid=162782231&st=&sw=&page=1,board_read.nhn?code=005930&nid=162782335&st=&sw=&page=1
https://finance.naver.com/item/board_read.nhn?code=005930&nid=162782231&st=&sw=&page=1,긴급 특급 뉴스,삼전은 재용이 빵에서 나올때까지 근 2년간은 하락하면서 헤멘다,2021.02.07T20:16,board_read.nhn?code=005930&nid=162782204&st=&sw=&page=1,board_read.nhn?code=005930&nid=162782329&st=&sw=&page=1
https://finance.naver.com/item/board_read.nhn?code=005930&nid=162782204&st=&sw=&page=1,왕창먹자 ,게임스톤 알지 개미들이 얼마나 무질한지 니들두 골로갈거야 왜냐면 선동질에댓가는 치러야지ㅡ막주남,2021.02.07T20:15,board_read.nhn?code=005930&nid=162782171&st=&sw=&page=1,board_read.nhn?code=005930&nid=162782231&st=&sw=&page=1
https://finance.naver.com/item/board_read.nhn?code=005930&nid=162782171&st=&sw=&page=1, 시ㅂㅔ리아철도 ㄱㅏ스관????? ,6.25 장깨한테 함 당한걸로 부족해.?? 이번엔 러시아에 당할라고 길까지터?? 그냥 소련ㄱㅏ서 고려인으로 살어 OOO들아 ㅗ 가덕도공항은 없던일로하4ㅗ ㅗ,2021.02.07T20:15,board_read.nhn?code=005930&nid=162782166&st=&sw=&page=1,board_read.nhn?code=005930&nid=162782204&st=&sw=&page=1
https://finance.naver.com/item/board_read.nhn?code=005930&nid=162782166&st=&sw=&page=1,교활한 박범계?  충청인의  망신?  박범개?  쪽바리 닮은 친문 위선자 집단 ,위선자 정권에선 간신이 출세하고 간신이 승진하니 어느 간신검사가 친문 위선자 집단이 해처드시는거 수사할건가여? ㅎㅋ,2021.02.07T20:15,board_read.nhn?code=005930&nid=162782099&st=&sw=&page=1,board_read.nhn?code=005930&nid=162782171&st=&sw=&page=1
https://finance.naver.com/item/board_read.nhn?code=005930&nid=162782099&st=&sw=&page=1,미국 EU 한국&대만 의존도 줄이고 반도체 독립선언~!!!,news.v.daum.net/v/20210207175218659,2021.02.07T20:14,board_read.nhn?code=005930&nid=162782095&st=&sw=&page=1,board_read.nhn?code=005930&nid=162782166&st=&sw=&page=1
https://finance.naver.com/item/board_read.nhn?code=005930&nid=162782095&st=&sw=&page=1,삼성전자는 하락해봐야...,연금이나 기관 최고점에서 10조이상 이익실현했고 외인는 관망하면서 선물매도 4조가량 늘렸다 이제 현물 매도 조금 하기 시작했다 걱정마라 외인는 한번 팔기 시작하면 계속 팔겠지만 딴주식들 5~10%이상 하락해도 삼성전자는 2~3%다 딴주식들 반토막나도 삼성전자는 30%이상 손실 안난다 대출 신용으로 최고점에 몰빵하고 오르길 기다리는 개인들이 많아서 문제긴 한데.... 폭락장이라면 예상보다 손실나겠지만 기다리면 다시 본전은 할테니 걱정마라,2021.02.07T20:14,board_read.nhn?code=005930&nid=162782092&st=&sw=&page=1,board_read.nhn?code=005930&nid=162782099&st=&sw=&page=1
https://finance.naver.com/item/board_read.nhn?code=005930&nid=162782092&st=&sw=&page=1,주식은 생물,사고나서 공부하면 상등신 사기전에 공부해라 현재는 과열시장이다 폭락이 시작되면 바로 피똥싼다 튈수 있는자만 투기해라 꼭 주식하고 싶으면 대체시장 찾아라,2021.02.07T20:14,board_read.nhn?code=005930&nid=162782065&st=&sw=&page=1,board_read.nhn?code=005930&nid=162782095&st=&sw=&page=1
https://finance.naver.com/item/board_read.nhn?code=005930&nid=162782065&st=&sw=&page=1,삼성 개잡주되었다,몇달간은 뒤빠꾸횡보야 주린이들 불쌍타,2021.02.07T20:13,board_read.nhn?code=005930&nid=162781876&st=&sw=&page=1,board_read.nhn?code=005930&nid=162782092&st=&sw=&page=1
https://finance.naver.com/item/board_read.nhn?code=005930&nid=162781876&st=&sw=&page=1,대한민국 검찰,한국 검찰은 정권 비리를 덮기 위해서 존재하는가? 한국 국민들은 바보들인가? 국민들을 쪼다 멍청이로 아는 정권이다.,2021.02.07T20:10,board_read.nhn?code=005930&nid=162781871&st=&sw=&page=1,board_read.nhn?code=005930&nid=162782065&st=&sw=&page=1
https://finance.naver.com/item/board_read.nhn?code=005930&nid=162781871&st=&sw=&page=1,웨어러블 터치ic칩 전세계1위 시스템반도체,지니틱스,2021.02.07T20:10,board_read.nhn?code=005930&nid=162781855&st=&sw=&page=1,board_read.nhn?code=005930&nid=162781876&st=&sw=&page=1
https://finance.naver.com/item/board_read.nhn?code=005930&nid=162781855&st=&sw=&page=1,모든 업종의 사업체 매물 한곳에 있는곳 알려준다,진짜 좋은 줍줍찬스다. 반도체슈퍼사이클 시작도 안했다 이제 열심히 주워 담아라. 연준은 지금 금융시장 붕괴를 절대 원하지 않는다. 2021년 금융시장에 거대한 버블이 만들어 진다. 지금 부동산 가격이 엄청난 버블인건 다 알지? 금융시장도 그렇게 될거다. 거품은 언젠가 당연히 붕괴되지. 근데 그게 올해는 아니다. 왜? 연준이 그걸 원하지 않으니까 쓸데없는 사업체나 부동산 정리하고 주식사라. 정리해서 목돈만들어서 우량주 사모으고  시드 없 는 애들은 사업해서 시드부터 빨리 모아라. 올해 선택이 니 3년뒤 신분을 바꿀거다. 구글에 컴파니마켓 쳐봐라 모든 사업체 매물 공짜로 다 거래된다.,2021.02.07T20:10,board_read.nhn?code=005930&nid=162781798&st=&sw=&page=1,board_read.nhn?code=005930&nid=162781871&st=&sw=&page=1
https://finance.naver.com/item/board_read.nhn?code=005930&nid=162781798&st=&sw=&page=1, 우주최강이다 ㄱㅐ처무능 ㅋㅋㅋ,문에어리언 우주최강,2021.02.07T20:09,board_read.nhn?code=005930&nid=162781766&st=&sw=&page=1,board_read.nhn?code=005930&nid=162781855&st=&sw=&page=1
https://finance.naver.com/item/board_read.nhn?code=005930&nid=162781766&st=&sw=&page=1,종인 그리고 태극기당,유물정치 그만하고 정당하게 하라~~,2021.02.07T20:08,board_read.nhn?code=005930&nid=162781731&st=&sw=&page=1,board_read.nhn?code=005930&nid=162781798&st=&sw=&page=1
https://finance.naver.com/item/board_read.nhn?code=005930&nid=162781731&st=&sw=&page=1,이런말쌈이자ㅡ뭉가리의복안ㅡ바이든이뭐라하던말던  퇴임1년남았는데 ㅡ대형사고한번치고나가지이거지 메롱♪♬♪♪,조 바이든의 국내 인맥으로 거론되는 조태용 국민의힘 의원ㅡㅡ “문죄인이 ‘종전선언’을 서두르면ㅡㅡ 전통 외교를 중시하는 바이든과 충돌할 것”이라고 경고★♥￦♥★ 서울경제와의 인터뷰ㅡㅡ “한미동맹과 주한미군  방위비분담금  전시작전통제권 전환 문제 등에서 정상적인 동맹관계로의 복귀를 기대한다” “바이든 행정부에는ㅡㅡㅡ 한미동맹을 포함해 미국의 전통적인 외교를 중시하는 인물들이 많다”고 제시했다. 박근혜 정부 시절 ㅡ청와대 국가안보실 1차장으로 근무할 당시 바이든 캠프의 외교·안보 선임자문을 맡은 토니 블링컨의 업무 파트너로 호흡을 맞춰 일한 바 있다. 바이든 행정부에 대해 ㅡㅡ가장 잘 알고 있는 국내 정치인 중 한 명이다. 바이든 당선인의 대북 정책과 관련ㅡㅡㅡ 현 정부가ㅡ 바이든의 대통령 취임 이후 바뀐 외교 기조를 무시하고 섣불리 종전선언을 하면 한미관계가 돌이킬 수 없는 곳으로 갈 수 있다고 경고 ★★★. 문재인이 ㅡ지난 9월 유엔총회 연설에서 강조한 종전선언과 바이든식 ‘체계적 북핵 협상’이 양립할 수 없다는 진단♥♥ 더욱이ㅡㅡㅡ 조 의원ㅡㅡ 동맹과의 결속을 중시하는 바이든이 한국 정부의 섣부른 종전선언을 한미동맹의 균열 또는 이탈로 인식할 수 있다고 했다 . “우리 정부도 ㅡㅡㅡ비핵화가 진전이 안 됐는데 종전선언을 먼저 한다든지   북한의 경제제재를 먼저 완화하려고 하면 바이든 행정부와 크게 부딪힐 것”이라며 “북한의 비핵화를 중심에 놓는 외교로의 자세를 가다듬는 게 필요하다”고 조언했다. 한국이ㅡㅡ 미국과 중국 사이에서 ‘ 전략적 모호성’을 유지하기 어렵다는 진단도 했다 . 바이든은 중국을 압박하기 위한 외교전략 캐치프레이즈로 ‘민주주의와 동맹’을 내걸었다. 그는 “바이든 행정부는 즉흥적이지 않고 체계적·주도적으로 외교를 하기 때문에 동맹국과 우방국에 자신들이 희망하는 요구를 구체적으로 이야기할 것”이라며 “우리 입장에서는 그 문제에 대해 심사숙고해서 모호성만 유지하지 않고 입장을 정해야 하는 부담이 생긴다”고 우려했다. 북한 문제와 관련해ㅡ 정상외교를 통한 도널드 트럼프식의 ‘담판정치’는 끝났다고 봤다 . “트럼프 정부의 ‘톱다운(정상 간 회담을 중심으로 협상을 전개하는 방식)’ 외교가ㅡㅡ 근본적으로 바뀌어 ‘바텀업(실무진 간 협의 결과에 따라 정상회담까지 하는 방식)’ 외교가 전개될 것” .★★♥★ 미국의 외교 실무자가ㅡㅡ 권한을 가지고 양국이 합의에 이르는 수준까지 협상을 진전시킨 후 바이든이 직접 나서는 방식이다★★ . 북한의 실질적인 비핵화가 확인되지 않으면 양국 정상회담은 기대하기 어렵다.,2021.02.07T20:07,board_read.nhn?code=005930&nid=162781708&st=&sw=&page=1,board_read.nhn?code=005930&nid=162781766&st=&sw=&page=1
https://finance.naver.com/item/board_read.nhn?code=005930&nid=162781708&st=&sw=&page=1,뉴스에 유럽 미국 반도체 탈한국 러쉬,끝장나네요 ㅡㅡㅋ,2021.02.07T20:07,board_read.nhn?code=005930&nid=162782210&st=&sw=&page=1,board_read.nhn?code=005930&nid=162781731&st=&sw=&page=1
https://finance.naver.com/item/board_read.nhn?code=005930&nid=162782210&st=&sw=&page=1,국민의힘.김종인 대표가.일본과 해저터널을 뚫자고?,이래 망하나 저래 망하나 똑 같은거다  지금 문 또라이 보다는 낳겠지 ! 멍충이 들아 !,2021.02.07T20:15,board_read.nhn?code=005930&nid=162781476&st=&sw=&page=1,board_read.nhn?code=005930&nid=162781708&st=&sw=&page=1
https://finance.naver.com/item/board_read.nhn?code=005930&nid=162781476&st=&sw=&page=1,유럽.미국.탈 한국 한다고 하는데...,삼성물건 안쓰겠다는 뜻인가요? 뉴스에 나왔는데 한국 반도체 미래는? 그리고 우리 경제는 어케되는가요? 앞으로 시간이 흐르면 한국경제는 ?,2021.02.07T20:03,board_read.nhn?code=005930&nid=162781441&st=&sw=&page=1,board_read.nhn?code=005930&nid=162781575&st=&sw=&page=1
https://finance.naver.com/item/board_read.nhn?code=005930&nid=162781441&st=&sw=&page=1,정부에서 도와주는것도  /////////////////////////////////,정부에서 도와주는것도 한계가있다 꼭 도움이 필요한사람만 도와주고 정부가 일자리를 만들고 일할수있도록 해줘야지 임금 채불업체가 많어 특히 노가다 모두가 살기 힘들어지고있다,2021.02.07T20:03,board_read.nhn?code=005930&nid=162781427&st=&sw=&page=1,board_read.nhn?code=005930&nid=162781476&st=&sw=&page=1
https://finance.naver.com/item/board_read.nhn?code=005930&nid=162781427&st=&sw=&page=1,동학개미들이여 깨어있으라!![반도체 전기차 AI 5G 등등],동학개미들이여 깨어있으라!![반도체 전기차 AI 5G 등등] 더 이상 어리석은 정부에 정치인들에 기관에 당하지 말라!! https://open.kakao.com/o/gQhoeeUc ※ 친애하고 사랑하는 3천만 개미 동포 여러분.... 우리가 왜 죽을 때까지 고생만하며 살다가 가야 합니까!? 우리는 그러라고 태어난게 아닙니다. 우리는 우리가 노력한 만큼 부를 축적하며 번성하고 번영하며 행복과 축복을 누리며 살아갈 가치가 있는 사람들 입니다. 그러나 오늘날 그것을 누가 방해하고 있습니까!? 바로 기관과 외인투자자들 그리고 크던 작던 존재하는 공매도 세력과 작전세력들 때문 입니다. 깨어 있으셔샤 합니다. 30~40년 만에 한 번 찾아오는 큰 시장의 싸이클이 드디어 왔습니다. 이 악하고 패역한 시대에서 현대판 노아의 방주에 올라탈 분들만 들어오시길 바랍니다. 그리고 여러분은 소중합니다. 충분히 노력한 만큼 보상을 받을 가치가 있는 소중한 분들입니다. 우리는 이제 우리의 재산과 우리의 가족과 우리의 소중한 것들을 스스로 지켜내야 합니다.,2021.02.07T20:03,board_read.nhn?code=005930&nid=162781642&st=&sw=&page=1,board_read.nhn?code=005930&nid=162781441&st=&sw=&page=1
https://finance.naver.com/item/board_read.nhn?code=005930&nid=162781642&st=&sw=&page=1,윤정희를 이해할 수 없다.,뭘 어쩌라고 ? 쌍팔년도 얘기를 여기서 왜 ?,2021.02.07T20:06,board_read.nhn?code=005930&nid=162781344&st=&sw=&page=1,board_read.nhn?code=005930&nid=162781427&st=&sw=&page=1
https://finance.naver.com/item/board_read.nhn?code=005930&nid=162781344&st=&sw=&page=1,김명수 대법원장님은  왜?  법복이  검은색인지  아시나요?,위선자들하고(친문위선자 집단)섞이지마세요? ㆍ하! 사법부만큼은 정치권(친문)눈치보지 말아야 ㆍ위선자 시대엔 간신이 출세하고 간신이 승진하니,2021.02.07T20:01,board_read.nhn?code=005930&nid=162781325&st=&sw=&page=1,board_read.nhn?code=005930&nid=162781385&st=&sw=&page=1
https://finance.naver.com/item/board_read.nhn?code=005930&nid=162781325&st=&sw=&page=1,여긴 조용하네 ㅎ,코구멍에 바람만 왔다 갔다 하는겨 하루종일 입에 개거품 나겠다,2021.02.07T20:01,board_read.nhn?code=005930&nid=162780958&st=&sw=&page=1,board_read.nhn?code=005930&nid=162781344&st=&sw=&page=1
https://finance.naver.com/item/board_read.nhn?code=005930&nid=162780958&st=&sw=&page=1,문죄인이 작품이다.거기다 퍼세주의자 이재명이 니들 대통령이라고?,문죄인이는 양산별라나라로. 더불어공산당은 연금 천국으로 도망가면그만이지만. 2030. 세기들은 뭐냐? 문죄인이와 4050대깨문 세기들이 퍼지른거 니들이 다 딱을래.2030.가시나들은 아예 생각어없드라마는. 한국  코로나19로 나라 곳간 너무 열었나 g-enews 2021.02.07 19:48가-가+ 한국 국가채무비율이 급증해 재정건전성에 빨간불이 켜졌다. 신종 코로나바이러스 감염증(코로나19)에 따른 경기침체를 막기 위해 정부가 나라 곳간을 열어 돈을 뿌리는 확장재정정책을 펼치고 있지만 이에 따른 국가채무비율이 크게 늘고 있기 때문이다. 일각에서는 국가채무비율 급증으로 국가신용등급에도 악영향을 줄 것이라는 경고음도 나온다. ◇한국 국가채무비율  코로나19 따른 확장재정정책으로 급증,2021.02.07T19:55,board_read.nhn?code=005930&nid=162780915&st=&sw=&page=1,board_read.nhn?code=005930&nid=162781325&st=&sw=&page=1
https://finance.naver.com/item/board_read.nhn?code=005930&nid=162780915&st=&sw=&page=1,삼성전자 투자전략  (20210208~20210210),삼성전자 투자전략 (20210208~20210210) 1) 2021/02/08~09일 : 하락시 BUY - 120분차트에서 82000 or 81000 저항받고 상승 2) 이유는 - 현재 T/P(전환점)은 아직 완성되지 않았슴. **투자전략: 82000/81000에서 BUY ***의견입니다. https://youtu.be/bIn2cTqyeoc,2021.02.07T19:54,board_read.nhn?code=005930&nid=162780908&st=&sw=&page=1,board_read.nhn?code=005930&nid=162780958&st=&sw=&page=1
https://finance.naver.com/item/board_read.nhn?code=005930&nid=162780908&st=&sw=&page=1,이제 더러운 이 게시판도 떠난다,카아악 퉤.,2021.02.07T19:54,board_read.nhn?code=005930&nid=162780778&st=&sw=&page=1,board_read.nhn?code=005930&nid=162780915&st=&sw=&page=1
https://finance.naver.com/item/board_read.nhn?code=005930&nid=162780778&st=&sw=&page=1,큰일   났다.  ,EU도 반도체 자립 나선다는데 .. 대만 한국에 의존했던 반도체 생산하겠다는데 이제 삼성 하이닉스 끝났다 . ㅡ 서경,2021.02.07T19:52,board_read.nhn?code=005930&nid=162780771&st=&sw=&page=1,board_read.nhn?code=005930&nid=162780908&st=&sw=&page=1
https://finance.naver.com/item/board_read.nhn?code=005930&nid=162780771&st=&sw=&page=1,우주최강 미남 문재인,그럼 외계인 이란 말이냐?,2021.02.07T19:52,board_read.nhn?code=005930&nid=162780738&st=&sw=&page=1,board_read.nhn?code=005930&nid=162780778&st=&sw=&page=1
https://finance.naver.com/item/board_read.nhn?code=005930&nid=162780738&st=&sw=&page=1,월요일  삼성 전자 폭등 ~~~,~~~~~~~~~~~~~~~~~~~~~~~~~~~~~~~~~~축하 합니다 ~~~,2021.02.07T19:51,board_read.nhn?code=005930&nid=162780634&st=&sw=&page=1,board_read.nhn?code=005930&nid=162780771&st=&sw=&page=1
https://finance.naver.com/item/board_read.nhn?code=005930&nid=162780634&st=&sw=&page=1,미국 반도체에 투자해라,형이 맨날 삼전게시판에 주린이들 놀린다고 장난치는데 간만에 좋은 말씀해준다 잘들어라 삼성전자는 CUP나 GPU를 만들 기술이 전혀 없다. (사실 여건도 안된다 정치적으로) 앞으로 미래 산업이 무었이냐 전기자동차?? 하늘을 나는 자동차?? 드론??? 6G??? 그것이 무었이든간에 중요한점은 전자장치가 필수적으로 들어간다는 점이고 모든 전자 장치에는 반도체가 핵심이라는거다 지금처럼 삼성이 램이나 찍어내면 뭐가 되겠냐???? 결국은 미국 하청업체 내지는 싸구려 램이나 계속 찍어내는거다 미국의 반도체 회사들은 삼성보다 기술력이 최소 10년이상 앞서가고 있다. 판단은 본인이 해라 대가리 빠가 아니면 뭔소린지 알아 듣겠지 단순히 개미 동학운동이니 애국 주식이니 개소리 집어치워라 주식은 니들 자산이라는점을 꼭 기억해라,2021.02.07T19:50,board_read.nhn?code=005930&nid=162780608&st=&sw=&page=1,board_read.nhn?code=005930&nid=162780738&st=&sw=&page=1
https://finance.naver.com/item/board_read.nhn?code=005930&nid=162780608&st=&sw=&page=1,곧 공매도 부활시 돈벌수 있는 주식 ~~~,~~~~~~~~~~~~~~~~~~~~~~~~~~~~~~~~~우리나라 최우량주 삼성 전자 ~~~ ~~~~~~~~~~~~~~~~~~~~~~~~~~~~~~~~~~~~~~이전 공매도 있었을때 많이 오른거 잘 아시지요 ~~~,2021.02.07T19:49,board_read.nhn?code=005930&nid=162780467&st=&sw=&page=1,board_read.nhn?code=005930&nid=162780634&st=&sw=&page=1
https://finance.naver.com/item/board_read.nhn?code=005930&nid=162780467&st=&sw=&page=1,... 신입사원에게 결재  합의 권한을 주는 이상한 반도체 회사그 내막이 궁금하다면 영상을 통해 확인하세요~#삼성 #,... 신입사원에게 결재  합의 권한을 주는 이상한 반도체 회사그 내막이 궁금하다면 영상을 통해 확인하세요~#삼성 # http://mkq502.yyo.kr/y.php?s=삼성전자,2021.02.07T19:47,board_read.nhn?code=005930&nid=162780426&st=&sw=&page=1,board_read.nhn?code=005930&nid=162780608&st=&sw=&page=1
https://finance.naver.com/item/board_read.nhn?code=005930&nid=162780426&st=&sw=&page=1,형제라도 미워 ////////////////////////////////,동생이 징징 그린다 못난놈 스스로 일어나라고 도와줬건만 자꾸 돈 빌려달라하고 의지한다 한두번도 아니고 스스로 밥벌이도 못하고 스스로 무능 해지는것 같아 돈있서도 못빌려준다고했다 내가 하나님이가 언제까지 도와달라고? 나를 이용하는것 같아 개심하다 하늘은 스스로돕는자를 돕는다 집안식구가 윈수네,2021.02.07T19:46,board_read.nhn?code=005930&nid=162780262&st=&sw=&page=1,board_read.nhn?code=005930&nid=162780467&st=&sw=&page=1
https://finance.naver.com/item/board_read.nhn?code=005930&nid=162780262&st=&sw=&page=1,한국의 게임스탑 10배 올려버리자,넷게임즈가 만든 블루아카이브 2월 4일 출시 일본 양대마켓 인기 1위(구글  애플 마켓),2021.02.07T19:43,board_read.nhn?code=005930&nid=162780192&st=&sw=&page=1,board_read.nhn?code=005930&nid=162780426&st=&sw=&page=1
https://finance.naver.com/item/board_read.nhn?code=005930&nid=162780192&st=&sw=&page=1,청와대 동의서,https://www1.president.go.kr/petitions/Temp/jtMS8s 삼성전자 주주님들 악덕기업 행태에 동의좀 부탁드립니다~~ 감사합니다,2021.02.07T19:42,board_read.nhn?code=005930&nid=162780176&st=&sw=&page=1,board_read.nhn?code=005930&nid=162780262&st=&sw=&page=1
https://finance.naver.com/item/board_read.nhn?code=005930&nid=162780176&st=&sw=&page=1,삼성종토방 맞나,그지같은 정치게시판인줄 정신사나워요 영감님들,2021.02.07T19:42,board_read.nhn?code=005930&nid=162780143&st=&sw=&page=1,board_read.nhn?code=005930&nid=162780192&st=&sw=&page=1
https://finance.naver.com/item/board_read.nhn?code=005930&nid=162780143&st=&sw=&page=1,부동산은끝났다  그러나 주식판은 끝나지 않았다,1. 승부사.. 인생의 반은 이 바닥에서... 맨땅으로 헤딩하면서.. 돌파구를 찾아왔다.. 2. 그리고... 증권사삐끼의 작전주  테마주 사기판을 멸망시킬 방법을 지속적으로 연구했다. 그리고 찾아내었다.. 바로 이때다... 개미가 기관을 멸망시킬 수 있다.. 지금과 같은 기회는 100년에 한번 오는 기회다. 3. 모조리 현금화하라.,2021.02.07T19:41,board_read.nhn?code=005930&nid=162780136&st=&sw=&page=1,board_read.nhn?code=005930&nid=162780176&st=&sw=&page=1
https://finance.naver.com/item/board_read.nhn?code=005930&nid=162780136&st=&sw=&page=1,월욜 갭상 예약,안티 개관 OOO들 피눈물 소리가 들리네 ㅋㅋ,2021.02.07T19:41,board_read.nhn?code=005930&nid=162780085&st=&sw=&page=1,board_read.nhn?code=005930&nid=162780143&st=&sw=&page=1
https://finance.naver.com/item/board_read.nhn?code=005930&nid=162780085&st=&sw=&page=1,삼성전자상,삼성전자 상간다,2021.02.07T19:40,board_read.nhn?code=005930&nid=162780067&st=&sw=&page=1,board_read.nhn?code=005930&nid=162780136&st=&sw=&page=1
https://finance.naver.com/item/board_read.nhn?code=005930&nid=162780067&st=&sw=&page=1,권리락 ,권리락 조심들 하세요,2021.02.07T19:40,board_read.nhn?code=005930&nid=162780048&st=&sw=&page=1,board_read.nhn?code=005930&nid=162780085&st=&sw=&page=1
https://finance.naver.com/item/board_read.nhn?code=005930&nid=162780048&st=&sw=&page=1,8만원대는 역사적 고점...기사 참조,서울경제 美 이어 EU까지..'반도체 자립' 나섰다 맹준호 기자 next@sedaily.com 입력 2021. 02. 07. 17:52 댓글 41개 이상...크하하핫,2021.02.07T19:40,board_read.nhn?code=005930&nid=162780015&st=&sw=&page=1,board_read.nhn?code=005930&nid=162780067&st=&sw=&page=1
https://finance.naver.com/item/board_read.nhn?code=005930&nid=162780015&st=&sw=&page=1,앵무새와 똑순이대결 ,나경원똑순이 화이팅!!!,2021.02.07T19:39,board_read.nhn?code=005930&nid=162779899&st=&sw=&page=1,board_read.nhn?code=005930&nid=162780048&st=&sw=&page=1
https://finance.naver.com/item/board_read.nhn?code=005930&nid=162779899&st=&sw=&page=1,미국이어 EU 까지.반도체 자립 나섰네요.,어쩐지. 외인기관 탈출하더만.,2021.02.07T19:37,board_read.nhn?code=005930&nid=162779890&st=&sw=&page=1,board_read.nhn?code=005930&nid=162780015&st=&sw=&page=1
https://finance.naver.com/item/board_read.nhn?code=005930&nid=162779890&st=&sw=&page=1,■■우주최강미남.문에어리언  ㅋㅋㅋㅋ,내가봐도 우주최강 에어리언 ㅋㅋㅋ,2021.02.07T19:37,board_read.nhn?code=005930&nid=162779868&st=&sw=&page=1,board_read.nhn?code=005930&nid=162779899&st=&sw=&page=1
https://finance.naver.com/item/board_read.nhn?code=005930&nid=162779868&st=&sw=&page=1,김기남부회장아저씨야,김기남부회장아저씨야 반드시 미국텍사스주 오스틴시에서 토지매입했다빨리 3nm나노급 비메모리  시스템 반도체 생산라인을 건립해라 그리고 인텔  AMD ( CPU  GPU  AP칩  이미지센서) 등등비메모리 분야에 선점해야한다 자동차용 반도체 회사 NXP반도체를 M&A 인수합병해라 1분기부터 동진쎄미켐 ArFi액침용 포토레지스트 생산하니깐 제품좀 많이좀써줘라 오스틴공장에도 동진꺼좀 팍팍짜리몽땅 왕창써주세요,2021.02.07T19:37,board_read.nhn?code=005930&nid=162779867&st=&sw=&page=1,board_read.nhn?code=005930&nid=162779890&st=&sw=&page=1
https://finance.naver.com/item/board_read.nhn?code=005930&nid=162779867&st=&sw=&page=1,설이후에 천지가 개벽할 것이다,1. 2020년 코로나 사태와 정확히 같은 패턴을 보일 것... 2. 그 미디어의 내용은... 승부사 이미 다 소설로 이야기했다. 이 마지막 승부는 희대의 대사기극으로 결말지어질 것이다. ㅋㅋㅋㅋㅋㅋㅋㅋㅋㅋㅋㅋㅋㅋㅋㅋㅋㅋㅋㅋㅋ,2021.02.07T19:37,board_read.nhn?code=005930&nid=162779752&st=&sw=&page=1,board_read.nhn?code=005930&nid=162779868&st=&sw=&page=1
