date,title,content,url,previousDiscussionUrl,nextDiscussionUrl
2021.02.19T13:51,28종목 비교와 코스피 지수 50%오를때 10%내린 최고의 실적종목 주목~,공매도 대부분 고가에서 매도 저가에 매수 차익? 그렇치 않다 고가에는? 현물의 차익실현이 우선인데 공매도를 발생시키다간 상대방이 먼저 매도하여 먼저 차익를 실현한다 고로 아래 참조 하시라~ 공매도 속성 1등기업 증명 영업이익률 이해 28종목 비교 맨아래 부분 28종목 비교 참조 먼저 공매도의 원리 간단하게 공매도란 정상가격 대비 주가가 높을때 이용하는 것이 아니다 주가가 높을때는 큰손이 올린 것이다 일단 고가로 올리고 흔든다 동종주가 대비 올릴때는적은금액으로 올리고 내릴때는 많은금액을 매도한다 흔들기를 제법 오래한다 그리하여 차익을 최대한 실현하면 주가가 제법 내려와 있다 그때서야 공매도를 계속 후려치어(즉 현물로 차익을 실현한후~고가에 공매도를 사용하면 개인들 혼비백산 줄행량 손해이다 고로 현물 반 이상 빠져 나온후 공매도 사용) 물론 매수 받히고 매도에 공매도 집중 매도인셈 어리석은 개인들 공매도에 혼비백산하고 큰손은 최저가에 물량 확보하는셈 (이때 개인은 역발상 하여 매수하면 대박인데 실제는 대분분이 반대로 매도하여 큰손실을 입는다) 종속기업 대부분이 장부가 대비 5~10배는 뛰어 10조의 가치는 충분~ 연도별 당기순이익 장부가 지분율 총포괄이익 종목~~nhnplayart~nhn japan 2015~~87억~~~~70억 적자 2016~~463억~~~83억흑자 2017~~454억~~~~97억 2018~~426억~~~~353억 2019~~416억~~~~458억 2020 종속기업이라 세부 자료 없슴 장부가~2140억~~~~531억 지분율~100%~~~~~100% 시가총액~비상장~~~비상장 총포괄손익424억~~~514억 (2019년) 아래 보시면 9.30일 기준 순자본 1조8947억에 Nhnplayart 장부가 531억에 작년흑자 424억 현재 nhn시총 1조4341에 흑자 424억이면 per34 나온다 게임주 평균이 per38 정도 되니 조금 손해를 보고 시총과 퉁 쳐보자 그럼 nhn 순자본 1조8947-531= 1조8416억은 불우이웃돕기 즉 모두다 코로나 불우이웃돕기 총정리(개인필독~)자산2조5628억 투자가 현재10조는 된다 아래는 2020.11.16일 분기 보고서 복사다 Nhn은 순자본1조8947억 부 채 6681억 합 2조5628억의 자금이 투자된 기업이다 아래 종속기업과 관계기업의 장부가가? 1조2105억중에 지분20~50%괸계기업은 584억이고 나머진 종속기업 장부가 이다 지분20%이하는?(아래 참고) 1445억+3334억 합4779억 투자이다 나머진 유형자산3793억 무형자산4796억이다 등등에 155억 투자 역으로 계산하면 1조2105+4779억+3793억+3334억+??155억을 추가하면 위에 총자산 2조5628억이 나온다 그럼 종속기업 실제가치 정검해 보자 11111 NHN Japan Corp.~장부가2134억이다 일본nhn(nhn japan과 nhnplayart 합산이다) 작년938억 흑자다 9배는 뛰어야 맞다 (per20 기준) 222222 #1 (9.24일)1조2168 (6월 계약하고 7~9월에 잔금 예상) 페이코 가격 1조2168억 1년새 5000억 뛰어~ 2.26%=275억 100%=275/2.26×100=1조2168억 Nhn기업이 아닌 주주간의 실제 거래다 아래 페이코 장부가?1866억 6배는 올라야 nhn지분68.42%의 금액이 된다 33333333333333 아래 고도는 장부가의 10.43배 위즈덤 하우스는 3.09배 Nhn고도(에이컴메이트 포함)10배는 뛰어야 된다 (단위:천원) 엔에이치엔고도㈜ 취득한 비지배지분의 장부금액 ~~~~~13 946 지분의 추가 취득으로 인해 지급한 금액 145 487 지배기업에 귀속되는 지분의 감소액 ~~131 541 145487/13946=10.43배 ㈜엔에이치엔벅스 취득한 비지배지분의 장부금액~~~~~769 685 지분의 추가 취득으로 인해 지급한 금액 886 325 지배기업에 귀속되는 지분의 감소액 ~~116 640 886325/769686=1.15배 ㈜엔에이치엔에듀 취득한 비지배지분의 장부금액~~~~~37 421 지분의 추가 취득으로 인해 지급한 금액 66 057 지배기업에 귀속되는 지분의 감소액~~ 28 636 66057/37421=1.77배 엔에이치엔한국사이버결제㈜ 취득한 비지배지분의 장부금액~~~~~ 2 718 697 지분의 추가 취득으로 인해 지급한 금액 15 800 547 지배기업에 귀속되는 지분의 감소액 ~~13 081 850 15800547/2718697=5.81배 ㈜위즈덤하우스 취득한 비지배지분의 장부금액~~~~~ 3 235 266 지분의 추가 취득으로 인해 지급한 금액 9 999 969 지배기업에 귀속되는 지분의 감소액~~6 764 703 9999969/3235266=3.09배 444444444 Nhn글로벌의 장부가1645억도 약 5배는 넘을 것 55555555 아래 토스트 자본금 30억이다 연구개발인력 약200명이다 2020.7.1일 출발 이다 Nhn은 7년전 부터 약200명 이상이 클라우드관련 연구개발을 했다 그리고 7.1일 토스트 연구개발에만 별도 설립이다 여기에 7년전부터 현재까지의 무형자산 가치는? 아마 3조는 넘을 것 시간관계상 여기 까지만 아래는 3분기 분기보고서 복사니 참고 하시라~~ 8. 종속기업  관계기업 및 공동기업 투자 당분기말과 전기말 현재 종속기업  관계기업 및 공동기업에 대한 투자 주식 내역은 다음과 같습니다. (단위:천원) 구 분 회사명 소재지 주요 영업활동 당분기말 전기말 지분율(%) 장부금액 지분율(%) 장부금액 종속기업 NHN Japan Corp.~100.00~ 213 997 173 엔에이치엔빅풋㈜~ 100.00 ~64 295 773 엔에이치엔픽셀큐브㈜~ 100.00~ 5 456 415 NHN GLOBAL  INC.~ 100.00~ 164 518 875 엔에이치엔고도㈜~ 74.44~ 53 734 395 ㈜피앤피시큐어 ~ 70.00~ 42 011 717 엔에이치엔위투㈜~ 100.00 ~20 933 729 엔에이치엔페이코㈜ ~ 68.42 ~186 581 993 ㈜엔에이치엔다이퀘스트 ~94.95~ 11 443 662 엔에이치엔에듀㈜~75.09 ~17 394 473 엔에이치엔토스트㈜~100.00~ 3 000 000 관계기업 ㈜파이오링크~ 28.97 ~19 673 432 ㈜구름 클라우드 ~ 22.22~ 1 000 200 합 계 1 210 503 383 9. 공정가치측정금융자산 당분기말과 전기말 현재 공정가치측정금융자산의 내역은 다음과 같습니다. (1) 기타포괄손익공정가치측정금융자산 (단위:천원) 구 분 ~당분기말 ~~~전기말 합 계 144 536 404 ~125 905 934 (2) 당기손익공정가치측정금융자산 (단위:천원) 구 분 ~당분기말 ~~~전기말 합 계333 375 473~ 355 911 435 (참고로 분사와 동시 1년 평균 클라우드관련 연구개발비 1207억과 총합 약9000억의 투자를 실제 했다는 것) #매출 대비 영업이익률로 사기치는 종목이 많아~ 매출은 전년대비 줄었는데도 이익은 그대로~ 매출대비 영업이익률이 올랐다고 여러종목에 사기치는 에널~들이 제법많이 등장하여~ 2.16일 종가기준 시가총액 대비 영업이익률 총정리~ 영업이익률를 매출에 대비하는 것은 잘못이다 새로운 것에 도전보단 안일에 의존하는 옛날 사고방식이다 그리고 매출10분의1로 줄고 이익은 2분의1로 줄면 이익률은 5배로 증가된다 영업이익률은 시가총액 대비가 합리적이고 정확하디 영업이익:2020년 pbr:2.16일 종가 기준 시총순위 20종목+비대면11-중복3 총합28종목 (아래 2020년 영업이익률=영업이익/시가총액 ) 영업이익률 pbr비교 시총순위 ~~~~주가~영업이익률~pbr 1.삼성전자~~~84 900~6.32~~2.15 2.Sk하이닉스 132 500~5.20~~1.80 3.LG화학 ~~978 000~3.41~~4.12 4.삼성전자우~ 76 200~6.32~~1.93 5.naver~~~~394 000~1.88~~8.87 6.삼성sdi ~~803 000~1.22~~4.26 7.삼성바이로796 000~0.56~~11.71 8.현대차~~~245 000~4.61~~0.92 9.셀트리온~325 000~1.75~~13.70 10.카카오~~514 000~1.00~~6.89 11.기아차~~85 700.~5.95~~1.18 12.현대모비스334 000~5.77~~0.94 13.sk이노베이284 500~적자~~1.58 14.LG전자~~172 500~10.76~1.99 15.LG생활건강1 627 000~4.80~~5.84 16.삼성물산~ 133 000~3.45~~0.90 17.POSCO~~ 271 500~1.02~~0.48 18.엔씨소프트 1 015 000~3.70~6.51 19.sk~~~~~303 500~미정~~0.89 20.SK텔레콤~251 000~6.66~~0.77 비대면 관련주(클라우드 비중높은 시총 1조이상 종목) 종목 ~~~~주가~영업이익률~pbr naver~ ~~366 500~2.02~~8.25 카카오~~~489 500~1.05~~6.57 더존비즈온 112 500~2.23~~9.19 Nhn~~~~~72 000~7.28~~0.82 Nhn한국사이 51 700~3.35~~8.31 비대면 관련주(게임주 시총 1조 이상 종목) 종목~~~~주가~영업이익률~pbr 엔씨소프트 1 027 000~3.62~6.59 넷마블~~~136 000~2.35~~2.18 펄어비스~~370 700~3.82~~6.52 카카오게임즈55 500~1.79~~4.50 컴투스~~~157 100~5.82~~1.95 웹젠~~~~~38 700~8.14~~2.93 #시총순위 20종목+비대면11주-중복3 총합28종목 (시총은 2.16일 종가기준 영업이익률 총정리) 시총순위 ~~2020영업이익(4분기)~영업이익률 1.삼성전자5 695 384~359939(90470)~6.32% 2.Sk하이닉스~ 964 603~50126(9659)~5.20% 3.LG화학~~~~690 393~23532(6736)~3.41% 4.삼성전자우(전자5 068 345+ 우627 039) 전자와 동일 5.naver~~~~647 197~12153(3238)~1.88% 6.삼성sdi ~~~552 179~6713(2462)~1.22% 7.삼성바이로직스526 673~2928(926)~0.56% 8.현대차~~~602 710~27813(16410)~4.61% 9.셀트리온438 743~3분기합5474+2183=1.75% 10.카카오~~~~455 762~4560(1498)~1.00% 11.기아차~~347 396~20665(12816)~5.95% 12.현대모비스 317 483~18303(7023)~5.77% 13.sk이노베이션 263 065~적자(적자)~적자 14.LG전자~~296 539~31918(6470)~10.76% 15.LG생활건강 254 108~12209(2563)~4.80% 16.삼성물산~~ 248 560~8571(2564)~3.45% 17.POSCO~~ 236 712~24030(8634)~1.02% 18.엔씨소프트~ 222 833~8248(1567)=3.70% 19.SK~~~~213 544~3분기합2694적자~미정 20.SK텔레콤~ 202 672~13493(3311)~6.66% 현대차 합 시총 596214 (현대차528828+우28863+2우B42323+3우B2696 LG전자 (282292+우14247)합288151 비대면 관련주(클라우드 비중 높은종목 시총1조이상 ) 종목~시가총액~2020영업이익(4분기)~영업이익률 naver~~~~647 197~12153(3238)~1.88% 카카오~~~~455 762~4560(1498)~1.00% 더존비즈온 33 964~~~767(267)~~~2.23% Nhn~~~~~~14 087~1025(203)~~~7.28% Nhn한국사이버결제11 876~398(108)~3.35% 비대면 관련주(게임주 종목 시총 1조 이상 ) 종목~~시가총액~2020영업이익(4분기)~영업이익률 엔씨소프트~ 222 833~8248(1567)=3.70% 넷마블~~~116 794~2720(825)~~~~2.33 펄어비스~~48 895~1573(200)~3.22% 카카오게임즈41 287~~~~666(166)~~1.61% 컴투스~~~20 213~~~1129(248)~~~5.59 웹젠~~~~~13 665~~~1083(388)~~7.93% 4분기 예상 영업이익 종목~기자 성함~예상영업이익 펄어비스~박효길~~391 .셀트리온~~강수윤~2183 업종 구분 1등 종목~5종목 구분별 ~ 시총20등 이내~클라우드관련주~게임주 영업이익률1등~LG전자~~~~NHN~~~~~웹젠 Pbr1등 ~~~~~POSCO~ ~ ~NHN~~~~컴투스,https://finance.naver.com/item/board_read.nhn?code=207940&nid=164471839&st=&sw=&page=1,board_read.nhn?code=207940&nid=164477954&st=&sw=&page=1,board_read.nhn?code=207940&nid=164459026&st=&sw=&page=1
2021.02.19T14:12,이럴때,붐할매수,https://finance.naver.com/item/board_read.nhn?code=207940&nid=164477954&st=&sw=&page=1,board_read.nhn?code=207940&nid=164483440&st=&sw=&page=1,board_read.nhn?code=207940&nid=164471839&st=&sw=&page=1
2021.02.19T14:29,삼성그룹 주주 단톡방입니다,삼성그룹 지배구조 관련 정보 공유방입니다. https://open.kakao.com/o/gTssdoyc 참여코드 삼성전자.종목코드 삼성그룹주주방 모임방에 오신걸 환영합니다 1 가입인사 2 공지 읽고 투표에 참여하기 3 1번 2번 순서대로 불이행시 강퇴됨 4. 단톡방 규칙을 꼭 읽어보시기 바랍니다 도배성 광고로 공지대로 하지 않을 경우 입장 후 강퇴됩니다 늦은 시간에.가입하셔도 꼭 인사와 투표해주세요 -,https://finance.naver.com/item/board_read.nhn?code=207940&nid=164483440&st=&sw=&page=1,board_read.nhn?code=207940&nid=164487866&st=&sw=&page=1,board_read.nhn?code=207940&nid=164477954&st=&sw=&page=1
2021.02.19T14:41,마이너스에서만 매수 장중 매도,방법은 짧게 조금만 먹으면 된다. 그냥 1년 이자 뽑는다,https://finance.naver.com/item/board_read.nhn?code=207940&nid=164487866&st=&sw=&page=1,board_read.nhn?code=207940&nid=164491021&st=&sw=&page=1,board_read.nhn?code=207940&nid=164483440&st=&sw=&page=1
2021.02.19T14:49,삼바 매출 1위,제약업계  코로나에도 매출 호조…삼성바이오로직스 1위 CEO스코어데일리 2021.02.19 07:05가-가+ 신종 코로나바이러스 감염증(코로나19) 대유행 상황에서도 시가총액 500대에 소속된 다수 제약사들은 실적을 개선하면서 지난해를 마무리했다. 19일 기업평가사이트 CEO스코어가 국내 시가총액 500대 기업 중 지난 15일까지 2020년 잠정실적을 공개한 326개 기업 실적을 조사한 결과  제약업종 내 42개 기업의 지난해 매출액은 전년비 7.9%(8511억원) 증가한 11조6044억원을 기록했다. 같은 기간 영업이익도 전년비 5.1%(225억원) 늘어난 4625억원으로 집계됐다. 지난해 조사 대상 전체 기업(326곳)의 매출이 2019년 수준과 같았으며 영업이익은 0.6% 증가한 것과 비교하면 높은 수치다. 제약업종 내 기업 중 매출액 증가액 기준으로 삼성바이오로직스가 1위를 차지했다. 삼성바이오로직스의 지난해 연결 기준 매출액은 1조1648억원으로 전년(개별 기준)비 66.0% 증가했다. 영업이익은 219.1%(2010억원) 늘어난 2928억원을 기록했다. 영업이익 증가액 기준으로도 1위에 해당하는 수치다. 삼성바이오로직스의 실적이 증가한 이유는 지난해 1  2  3 공장이 전체 가동된 영향이라고 회사 측은 설명했다. 이어 매출액 증가액 기준으로 △종근당(2237억원↑) △GC녹십자(1344억원↑) △서흥(923억원↑) △휴온스(417억원↑) △오스코텍(391억원↑) △보령제약(376억원↑) △JW중외제약(361억원↑) △아이큐어(300억원↑) △GC녹십자랩셀(277억원↑) 등이 상위 10위 안에 안착했다. 기존에 판매됐던 의약품도 매출이 증가했지만 코로나19 특수를 맞은 독감백신이나 진단키트의 판매 증가도 제약업종의 전체 매출을 끌어올리는 데 기여한 것으로 분석되고 있다. 조사대상 42개 제약바이오 기업 중 매출이 전년과 같거나 감소한 곳은 전체의 42.9%인 18곳이었다. [CEO스코어데일리 / 김윤선 기자 / yskk@ceoscore.co.kr],https://finance.naver.com/item/board_read.nhn?code=207940&nid=164491021&st=&sw=&page=1,board_read.nhn?code=207940&nid=164494388&st=&sw=&page=1,board_read.nhn?code=207940&nid=164487866&st=&sw=&page=1
2021.02.19T14:58,주식 돈벌기 쉽다,직장 필요 없다 소상공인 주식으로 성공 소 상공인 주식투자 모임...,https://finance.naver.com/item/board_read.nhn?code=207940&nid=164494388&st=&sw=&page=1,board_read.nhn?code=207940&nid=164495908&st=&sw=&page=1,board_read.nhn?code=207940&nid=164491021&st=&sw=&page=1
2021.02.19T15:02,드디어 일주일만에 외국인들이 많이 들어왔네요..,다음주 82층 가능해 보임.. 물론 저는 바로 튈거임 ㅜㅜ,https://finance.naver.com/item/board_read.nhn?code=207940&nid=164495908&st=&sw=&page=1,board_read.nhn?code=207940&nid=164495963&st=&sw=&page=1,board_read.nhn?code=207940&nid=164494388&st=&sw=&page=1
2021.02.19T15:03,오로지 ,삼성관련만 사믄 개관들이 알아서 올려주는데 후회막급이다,https://finance.naver.com/item/board_read.nhn?code=207940&nid=164495963&st=&sw=&page=1,board_read.nhn?code=207940&nid=164495965&st=&sw=&page=1,board_read.nhn?code=207940&nid=164495908&st=&sw=&page=1
2021.02.19T15:03,가자 80층으로,.,https://finance.naver.com/item/board_read.nhn?code=207940&nid=164495965&st=&sw=&page=1,board_read.nhn?code=207940&nid=164498731&st=&sw=&page=1,board_read.nhn?code=207940&nid=164495963&st=&sw=&page=1
2021.02.19T15:10,셀트~ 실적발표는  언제?,오늘이나 월요일 일듯한데.. 궁금합니다 기대되구요~ 작년보단 올해부터가 찐 실적 나올듯 합니다 내년은 더더욱 큰기대됩니다. (절대팔지마세요~ 100~200가는중입니다),https://finance.naver.com/item/board_read.nhn?code=207940&nid=164498731&st=&sw=&page=1,board_read.nhn?code=207940&nid=164501906&st=&sw=&page=1,board_read.nhn?code=207940&nid=164495965&st=&sw=&page=1
2021.02.19T15:18,갑자기 왜 오르는겨~?,뭔일 있남~? 아!!! 큰형님 에이치엘비가 급등했구나,https://finance.naver.com/item/board_read.nhn?code=207940&nid=164501906&st=&sw=&page=1,board_read.nhn?code=207940&nid=164504056&st=&sw=&page=1,board_read.nhn?code=207940&nid=164498731&st=&sw=&page=1
2021.02.19T15:23,■ 씨젠보다 매출적은게 시총 10배,얼마나 주가를 뻥티기 했으면 말도 안나오네 승계를 위해 올려도 정도것 올려야지... 나원 씨젠보다 매출도 적은게 시총은 10배 높네 거품 킹왕짱 처먹어라!,https://finance.naver.com/item/board_read.nhn?code=207940&nid=164504056&st=&sw=&page=1,board_read.nhn?code=207940&nid=164504541&st=&sw=&page=1,board_read.nhn?code=207940&nid=164501906&st=&sw=&page=1
2021.02.19T15:24,이 등신은 왜올라~,무식한 주식이~~,https://finance.naver.com/item/board_read.nhn?code=207940&nid=164504541&st=&sw=&page=1,board_read.nhn?code=207940&nid=164513352&st=&sw=&page=1,board_read.nhn?code=207940&nid=164504056&st=&sw=&page=1
2021.02.19T15:55,[삭제된 게시물의 답글]==== 수급  ^&^  현황 ====,감사합니다,https://finance.naver.com/item/board_read.nhn?code=207940&nid=164513352&st=&sw=&page=1,board_read.nhn?code=207940&nid=164510341&st=&sw=&page=1,board_read.nhn?code=207940&nid=164504541&st=&sw=&page=1
2021.02.19T15:42,여기는 왜 오르는지,이유 좀 알려주쇼?,https://finance.naver.com/item/board_read.nhn?code=207940&nid=164510341&st=&sw=&page=1,board_read.nhn?code=207940&nid=164512841&st=&sw=&page=1,board_read.nhn?code=207940&nid=164513352&st=&sw=&page=1
2021.02.19T15:53,열흘 동안흘러내리다 빨간색들어오니 흥분되네..,겨우 이거오르고..내가 좋아해야할지 참..난감하다..,https://finance.naver.com/item/board_read.nhn?code=207940&nid=164512841&st=&sw=&page=1,board_read.nhn?code=207940&nid=164518537&st=&sw=&page=1,board_read.nhn?code=207940&nid=164515770&st=&sw=&page=1
2021.02.19T16:22,담주 오릅니다,다음주 쭈우욱 폭등할 기회 단한번 오니 지루하신분은 그 기회를 잡아 나가셔도 됩니다ㆍ,https://finance.naver.com/item/board_read.nhn?code=207940&nid=164518537&st=&sw=&page=1,board_read.nhn?code=207940&nid=164518984&st=&sw=&page=1,board_read.nhn?code=207940&nid=164512841&st=&sw=&page=1
2021.02.19T16:25,어제 입성했는데 오늘 오른다 했자나 양주는 아니더라도 막걸리 먹자 했자나,그래 주식은 맘을 편하게 먹으면 댄단다 얘들아 알지? 막걸리 먹자,https://finance.naver.com/item/board_read.nhn?code=207940&nid=164518984&st=&sw=&page=1,board_read.nhn?code=207940&nid=164519726&st=&sw=&page=1,board_read.nhn?code=207940&nid=164518537&st=&sw=&page=1
2021.02.19T16:30,서정진회장 말씀좀 듣자,서회장님이 전국민 코로나 검사해서  양성되면 치료제로 바로 치료하고  경증이든 뭐든 약값도 원가로 제공한다는데 그래서 코로나 청정국가 만들면 소상공인들 고생안하고 마음껏 경제활동하고 뭐가 나라를 위한 일인지 모르나? 제발 서회장 말씀 대로 한번만 해보자..등신들아.,https://finance.naver.com/item/board_read.nhn?code=207940&nid=164519726&st=&sw=&page=1,board_read.nhn?code=207940&nid=164521110&st=&sw=&page=1,board_read.nhn?code=207940&nid=164518984&st=&sw=&page=1
2021.02.19T16:38,직원 빼 올 차례구나.,삼성 주특기 공장은 다 지었고 기술이 없으니 이젠 셀트 직원이나 슬슬 빼오까?,https://finance.naver.com/item/board_read.nhn?code=207940&nid=164521110&st=&sw=&page=1,board_read.nhn?code=207940&nid=164523055&st=&sw=&page=1,board_read.nhn?code=207940&nid=164519726&st=&sw=&page=1
2021.02.19T16:51,삼성바이오로직스 더 오릅니다. 차트분석 공유 ,http://naver.me/GaLaueTe,https://finance.naver.com/item/board_read.nhn?code=207940&nid=164523055&st=&sw=&page=1,board_read.nhn?code=207940&nid=164527928&st=&sw=&page=1,board_read.nhn?code=207940&nid=164521110&st=&sw=&page=1
2021.02.19T17:27,여깁니까,행님들 쌈바 춤이 절로 나온다는 그곳이?,https://finance.naver.com/item/board_read.nhn?code=207940&nid=164527928&st=&sw=&page=1,board_read.nhn?code=207940&nid=164530544&st=&sw=&page=1,board_read.nhn?code=207940&nid=164523055&st=&sw=&page=1
2021.02.19T17:50,지들끼리 자전거래에 속는,불쌍한 개미들~,https://finance.naver.com/item/board_read.nhn?code=207940&nid=164530544&st=&sw=&page=1,board_read.nhn?code=207940&nid=164531347&st=&sw=&page=1,board_read.nhn?code=207940&nid=164527928&st=&sw=&page=1
2021.02.19T17:57,연기금이 매수 하는 곳이 이곳입니까~~~~!!,다른 주식 다 던저도 이곳만큼은 매수 한다는 연기금 매수 명당 +_+??,https://finance.naver.com/item/board_read.nhn?code=207940&nid=164531347&st=&sw=&page=1,board_read.nhn?code=207940&nid=164546644&st=&sw=&page=1,board_read.nhn?code=207940&nid=164530544&st=&sw=&page=1
2021.02.19T22:25,승계 이제 필요도 없는데,그동안 인위적으로 쳐올린 거품 좀 빼쟈 그동안 안낼려고 온갖 짓거리 다 해 회피한 세금 착착 다 내고 삼바는 그냥 매출 이익 수준에 맞게 20만원대로 조정간 다음에 다시 새출발 하쟈 모든건 다 정도로 가야 하지 않겟느뇨 ? ㅋㅋ,https://finance.naver.com/item/board_read.nhn?code=207940&nid=164546644&st=&sw=&page=1,board_read.nhn?code=207940&nid=164548089&st=&sw=&page=1,board_read.nhn?code=207940&nid=164531347&st=&sw=&page=1
2021.02.19T22:59,찍소리도 못하는 불쌍한 삼바주주들 ㅋ,게시판을 찬찬히 보니 정말 가관이다 ~ㅎ jy는 추가 뜨면 불가석방일텐데 삼바 이미지 정말 ㅈ 같이 변해간다. 자업자득이다. ㅎ 이런 글에 찍소리도 못하는 삼바주주들 ㅎㅎ,https://finance.naver.com/item/board_read.nhn?code=207940&nid=164548089&st=&sw=&page=1,board_read.nhn?code=207940&nid=164548363&st=&sw=&page=1,board_read.nhn?code=207940&nid=164546644&st=&sw=&page=1
2021.02.19T23:06,여긴 인텔리 거지들만 들썩이네,진짜 돈들고 투자한 주주들은 웃고 있는데 ㅎ 주식은 1주도 없고 주댕이만 나불대는 인텔리 거지들... 아무리 니들 먼지들이 떠들어 대봐야 변하는게 없는데 어쩌냐..ㅉㅉ,https://finance.naver.com/item/board_read.nhn?code=207940&nid=164548363&st=&sw=&page=1,board_read.nhn?code=207940&nid=164548593&st=&sw=&page=1,board_read.nhn?code=207940&nid=164548089&st=&sw=&page=1
2021.02.19T23:11,신고가,갱신한다,https://finance.naver.com/item/board_read.nhn?code=207940&nid=164548593&st=&sw=&page=1,board_read.nhn?code=207940&nid=164552404&st=&sw=&page=1,board_read.nhn?code=207940&nid=164548363&st=&sw=&page=1
2021.02.20T00:42,셀벌레들아,삼바 게시판에서 너희 벌레들이 아무리 개판을 쳐도 위대한 삼바 주주들은 신경도 안 쓴다. 왜냐고? 삼바는 어차피 갈 주식이거든ㅋㅋ 출근 도장 꼭 찍고 매일같이 안티짓하느라 고생이 많다 수고혀^^ 답장은 생략해. 어차피 종토방 잘 안보거든ㅋㅋ,https://finance.naver.com/item/board_read.nhn?code=207940&nid=164552404&st=&sw=&page=1,board_read.nhn?code=207940&nid=164557353&st=&sw=&page=1,board_read.nhn?code=207940&nid=164548593&st=&sw=&page=1
2021.02.20T06:56,광고 하러 왔습니다 구경오세요,위니아딤채 시총1000억 영업이익500억 콜드체인 관련주 자회사 하반기상장 현주가2000원대 분식회계로 거래정지 과징금9억 월요일 거래재개,https://finance.naver.com/item/board_read.nhn?code=207940&nid=164557353&st=&sw=&page=1,board_read.nhn?code=207940&nid=164559296&st=&sw=&page=1,board_read.nhn?code=207940&nid=164552404&st=&sw=&page=1
2021.02.20T08:39,작년주가 패턴이라면,월 화 수 양봉 목 음봉 금 양봉 이건 예측입니다^^ 이렇게?으면좋겠네요 이름값좀 합시다 삼바!!,https://finance.naver.com/item/board_read.nhn?code=207940&nid=164559296&st=&sw=&page=1,board_read.nhn?code=207940&nid=164560750&st=&sw=&page=1,board_read.nhn?code=207940&nid=164557353&st=&sw=&page=1
2021.02.20T09:26,씨젠 영익 반도안되는데,시총은 10배가 넘네 말이 됩니까?,https://finance.naver.com/item/board_read.nhn?code=207940&nid=164560750&st=&sw=&page=1,board_read.nhn?code=207940&nid=164561861&st=&sw=&page=1,board_read.nhn?code=207940&nid=164559296&st=&sw=&page=1
2021.02.20T09:59,주식은 미래의 꿈 을 먹고 오르는것  ,삼바 잘될고 있다 우상향 날아가자,https://finance.naver.com/item/board_read.nhn?code=207940&nid=164561861&st=&sw=&page=1,board_read.nhn?code=207940&nid=164562709&st=&sw=&page=1,board_read.nhn?code=207940&nid=164560750&st=&sw=&page=1
